{
  "race_id": "synthetic-race-001",
  "config": {
    "method_id": "vp-pinned-2122f254-synthetic",
    "method": {
      "party_proxy_weight": 0.5,
      "index_scale": 0.5,
      "minimum_answers": 2,
      "cfscore_intercept": -0.098,
      "cfscore_slope": 0.456,
      "tie_threshold": 0.03,
      "star_minimum_own_positions": 4
    },
    "questions": [
      {"id": "synthetic_a", "left_answer": "yes", "active": true, "reviewed": true},
      {"id": "synthetic_b", "left_answer": "no", "active": true, "reviewed": true},
      {"id": "synthetic_c", "left_answer": "yes", "active": true, "reviewed": true},
      {"id": "synthetic_d", "left_answer": "no", "active": true, "reviewed": true}
    ]
  },
  "answers": {
    "synthetic_a": "yea",
    "synthetic_b": "yea",
    "synthetic_c": "nay",
    "synthetic_d": "nay"
  },
  "candidates": [
    {
      "candidate_id": "synthetic-alpha",
      "party": "SYN-A",
      "votes": {"synthetic_a": "yes"},
      "statements": {
        "synthetic_b": {"stance": "no", "reading": "stated"},
        "synthetic_d": {"stance": "no", "reading": "leans"}
      },
      "party_proxy": {"synthetic_c": "no"},
      "dw_nominate": {"value": 0.25, "votes_scored": 40}
    },
    {
      "candidate_id": "synthetic-beta",
      "party": "SYN-B",
      "votes": {
        "synthetic_a": "no",
        "synthetic_c": "yes"
      },
      "statements": {
        "synthetic_b": {"stance": "yes", "reading": "stated"},
        "synthetic_d": {"stance": "no", "reading": "stated"}
      },
      "party_proxy": {},
      "cfscore": {"value": 0.0, "cycle": 2098}
    },
    {
      "candidate_id": "synthetic-gamma",
      "party": "SYN-C",
      "votes": {},
      "statements": {
        "synthetic_a": {"stance": "yes", "reading": "stated"}
      },
      "party_proxy": {}
    }
  ]
}

